{
  "schemaVersion": "2.0",
  "conversationId": "session-XXXXXXXX-XXXX",
  "task": {
    "name": "厂站近区潮流图自动生成",
    "description": "基于 D6.0 工程实现厂站近区潮流图布局/布线/标注算法并远程编译验证",
    "result": "completed",
    "summary": "完成需求分析→方案设计→开发实现→测试验证；测试首轮发现 3 个问题，返回开发修复后重新测试全部通过。"
  },
  "phases": [
    {
      "id": "requirement",
      "name": "需求分析",
      "actualDuration": 5400000
    },
    {
      "id": "design",
      "name": "方案设计",
      "actualDuration": 2700000
    },
    {
      "id": "development",
      "name": "开发实现",
      "actualDuration": 15120000
    },
    {
      "id": "test",
      "name": "测试验证",
      "actualDuration": 11280000
    }
  ],
  "timeline": [
    {
      "id": "run-01",
      "phaseId": "requirement",
      "type": "normal",
      "steps": [
        {
          "id": "req-01",
          "name": "接收任务",
          "description": "接收厂站近区潮流图自动生成任务，明确范围与交付标准",
          "tags": [
            "用户需求",
            "D6.0项目知识"
          ],
          "inputs": [
            "任务卡描述",
            "潮流图样例"
          ],
          "calls": [
            "D6.0项目知识库"
          ],
          "outputs": [
            "明确目标：布局/布线/标注自动生成",
            "明确输出：可编译工程代码"
          ],
          "artifactIds": [],
          "replayDuration": 2800
        },
        {
          "id": "req-02",
          "name": "分析现有工程",
          "description": "梳理相关模块、代码结构和数据接口，明确改造范围",
          "tags": [
            "工程源码",
            "D6.0项目知识",
            "源码检索"
          ],
          "inputs": [
            "D6.0工程源码",
            "项目文档"
          ],
          "calls": [
            "D6.0项目知识库",
            "源码检索"
          ],
          "outputs": [
            "定位核心基类与注册机制",
            "圈定 3 个算法实现点"
          ],
          "artifactIds": [
            "artifact-requirement"
          ],
          "replayDuration": 3000
        },
        {
          "id": "req-03",
          "name": "提取关键约束",
          "description": "整理设计规则与编程约束清单",
          "tags": [
            "设计规则",
            "D6.0项目知识"
          ],
          "inputs": [
            "设计规则库",
            "编程约束文档"
          ],
          "calls": [
            "D6.0项目知识库"
          ],
          "outputs": [
            "12 条设计规则",
            "C++03/GBK 约束清单"
          ],
          "artifactIds": [],
          "replayDuration": 2600
        },
        {
          "id": "req-04",
          "name": "人工确认需求",
          "description": "向用户确认需求理解与范围边界",
          "tags": [
            "方案文档",
            "人工确认"
          ],
          "inputs": [
            "需求分析说明"
          ],
          "calls": [
            "人工确认"
          ],
          "outputs": [
            "需求口径确认"
          ],
          "status": "confirmed",
          "artifactIds": [],
          "replayDuration": 2400
        }
      ],
      "artifacts": [
        {
          "id": "artifact-requirement",
          "name": "需求分析说明",
          "type": "document",
          "path": "artifacts/requirement.md",
          "description": "范围、约束与验收口径"
        }
      ],
      "metrics": [
        {
          "name": "分析文件",
          "value": "25个"
        },
        {
          "name": "核心约束",
          "value": "7项"
        },
        {
          "name": "工程要求",
          "value": "20+"
        },
        {
          "name": "人工确认",
          "value": "2次"
        }
      ]
    },
    {
      "id": "run-02",
      "phaseId": "design",
      "type": "normal",
      "steps": [
        {
          "id": "design-01",
          "name": "分析现有架构",
          "description": "研究存量代码的类结构、数据流与扩展点",
          "tags": [
            "工程源码",
            "D6.0项目知识",
            "源码检索"
          ],
          "inputs": [
            "D6.0工程源码",
            "基类文档"
          ],
          "calls": [
            "D6.0项目知识库",
            "源码检索"
          ],
          "outputs": [
            "确定复用基类与注册入口"
          ],
          "artifactIds": [],
          "replayDuration": 3000
        },
        {
          "id": "design-02",
          "name": "确定实现方案",
          "description": "形成布局、布线、标注算法设计及主要修改点",
          "tags": [
            "详细设计",
            "D6.0项目知识",
            "代码开发Skill"
          ],
          "inputs": [
            "D6.0工程源码",
            "自动成图设计方案"
          ],
          "calls": [
            "D6.0项目知识库",
            "代码开发Skill"
          ],
          "outputs": [
            "自动布局算法设计",
            "自动布线算法设计",
            "自动标注算法设计",
            "代码修改清单"
          ],
          "artifactIds": [
            "artifact-design"
          ],
          "replayDuration": 3200
        },
        {
          "id": "design-03",
          "name": "人工确认方案",
          "description": "确认关键技术路线后继续执行",
          "tags": [
            "方案文档",
            "人工确认"
          ],
          "inputs": [
            "自动成图设计方案"
          ],
          "calls": [
            "人工确认"
          ],
          "outputs": [
            "技术方案确认"
          ],
          "status": "confirmed",
          "artifactIds": [],
          "replayDuration": 2400
        }
      ],
      "artifacts": [
        {
          "id": "artifact-design",
          "name": "自动成图设计方案",
          "type": "document",
          "path": "artifacts/design.md",
          "description": "布局/布线/标注三算法设计"
        }
      ],
      "metrics": [
        {
          "name": "方案比选",
          "value": "3套"
        },
        {
          "name": "核心算法",
          "value": "3个"
        },
        {
          "name": "代码修改点",
          "value": "8处"
        },
        {
          "name": "人工确认",
          "value": "1次"
        }
      ]
    },
    {
      "id": "run-03",
      "phaseId": "development",
      "type": "normal",
      "steps": [
        {
          "id": "dev-01",
          "name": "编写布局算法",
          "description": "实现厂站潮流图自动布局核心代码",
          "tags": [
            "工程源码",
            "代码开发Skill"
          ],
          "inputs": [
            "D6.0工程源码",
            "自动成图设计方案"
          ],
          "calls": [
            "D6.0项目知识库",
            "代码开发Skill"
          ],
          "outputs": [
            "完成自动布局核心算法",
            "修改 3 个源文件"
          ],
          "artifactIds": [
            "artifact-layout"
          ],
          "replayDuration": 3000
        },
        {
          "id": "dev-02",
          "name": "编写布线算法",
          "description": "实现正交布线与绕障逻辑",
          "tags": [
            "工程源码",
            "代码开发Skill"
          ],
          "inputs": [
            "D6.0工程源码",
            "自动成图设计方案"
          ],
          "calls": [
            "代码开发Skill"
          ],
          "outputs": [
            "完成自动布线核心代码"
          ],
          "artifactIds": [
            "artifact-router"
          ],
          "replayDuration": 3000
        },
        {
          "id": "dev-03",
          "name": "编写标注算法",
          "description": "实现文本标注布局与避让",
          "tags": [
            "工程源码",
            "代码开发Skill"
          ],
          "inputs": [
            "D6.0工程源码",
            "自动成图设计方案"
          ],
          "calls": [
            "代码开发Skill"
          ],
          "outputs": [
            "完成自动标注核心代码"
          ],
          "artifactIds": [],
          "replayDuration": 3000
        },
        {
          "id": "dev-04",
          "name": "安全扫描",
          "description": "对新增代码做安全与规则检查",
          "tags": [
            "工程源码",
            "设计规则"
          ],
          "inputs": [
            "开发后源码",
            "设计规则清单"
          ],
          "calls": [
            "代码开发Skill"
          ],
          "outputs": [
            "扫描无安全告警"
          ],
          "artifactIds": [],
          "replayDuration": 2200
        },
        {
          "id": "dev-05",
          "name": "工程编译",
          "description": "调用真实工程环境完成编译验证",
          "tags": [
            "远程编译Skill",
            "工程源码"
          ],
          "inputs": [
            "打包后源码"
          ],
          "calls": [
            "远程编译Skill"
          ],
          "outputs": [
            "BUILD_EXIT=0 编译通过"
          ],
          "artifactIds": [
            "artifact-build1"
          ],
          "replayDuration": 2800
        }
      ],
      "artifacts": [
        {
          "id": "artifact-layout",
          "name": "自动布局源码",
          "type": "code",
          "path": "artifacts/source/layout.cpp",
          "description": "厂站潮流图自动布局核心代码"
        },
        {
          "id": "artifact-router",
          "name": "自动布线源码",
          "type": "code",
          "path": "artifacts/source/router.cpp",
          "description": "正交布线核心代码"
        },
        {
          "id": "artifact-build1",
          "name": "编译验证报告",
          "type": "report",
          "path": "artifacts/build-round1.md",
          "description": "首轮编译零错误"
        }
      ],
      "metrics": [
        {
          "name": "核心算法",
          "value": "3个"
        },
        {
          "name": "修改文件",
          "value": "7个"
        },
        {
          "name": "修改优化",
          "value": "2轮"
        },
        {
          "name": "编译错误",
          "value": "0个"
        }
      ]
    },
    {
      "id": "run-04",
      "phaseId": "test",
      "type": "normal",
      "steps": [
        {
          "id": "test-01",
          "name": "生成测试用例",
          "description": "生成 17 项测试用例覆盖边界与典型场景",
          "tags": [
            "测试环境",
            "工程源码"
          ],
          "inputs": [
            "设计方案",
            "算法源码"
          ],
          "calls": [
            "测试环境"
          ],
          "outputs": [
            "17 项测试用例清单"
          ],
          "artifactIds": [
            "artifact-cases1"
          ],
          "replayDuration": 2800
        },
        {
          "id": "test-02",
          "name": "执行场景验证",
          "description": "在真实工程环境执行端到端场景验证",
          "tags": [
            "测试环境",
            "测试日志"
          ],
          "inputs": [
            "工程环境",
            "测试用例"
          ],
          "calls": [
            "测试环境"
          ],
          "outputs": [
            "发现 3 个问题：布线越界/标注重叠/边距异常"
          ],